http://rss.nytimes.com/services/xml/rss/nyt/Technology.xml;https://www.nytimes.com/2022/09/07/technology/apple-new-iphone-watch.html;2022-09-07 19:13:42+00:00;False;Apple Unveils New iPhone and Fitness Watch at Annual Event;For the first time in the pandemic, the company returned to Steve Jobs Theater to release its latest product updates.
http://rss.nytimes.com/services/xml/rss/nyt/Technology.xml;https://www.nytimes.com/2022/09/07/business/apple-new-iphone-watch.html;2022-09-07 18:38:40+00:00;False;Apple Unveils New iPhone and Fitness Watch at Annual Event;For the first time in the pandemic, the company returned to Steve Jobs Theater to release its latest product updates.
http://rss.nytimes.com/services/xml/rss/nyt/Technology.xml;https://www.nytimes.com/2022/09/07/business/apple-smartwatch-event.html;2022-09-07 17:53:45+00:00;False;Apple Unveils Smartwatch With a Focus on Fitness;For the first time in the pandemic, the company returned to Steve Jobs Theater to release its latest product updates.
http://rss.nytimes.com/services/xml/rss/nyt/Technology.xml;https://www.nytimes.com/2022/09/07/technology/digital-divide.html;2022-09-07 17:39:17+00:00;False;One Solution to the Digital Divide: Teens;Closing the online gap in America will require everything we’ve got, including video game-playing teenagers.
http://rss.nytimes.com/services/xml/rss/nyt/Technology.xml;https://www.nytimes.com/2022/09/07/technology/musk-twitter-whistle-blower.html;2022-09-07 15:08:08+00:00;False;Judge Says Musk Can Include Whistle-Blower Claims in Twitter Case;Elon Musk’s lawyers had asked for a delay to review the accusations by a former Twitter executive, which the judge denied, while allowing the information to form part of their case.
http://rss.nytimes.com/services/xml/rss/nyt/Technology.xml;https://www.nytimes.com/2022/09/07/technology/a-judge-allows-musk-to-include-whistle-blower-claims-in-his-case-against-twitter.html;2022-09-07 15:01:04+00:00;False;A judge allows Musk to include whistle-blower claims in his case against Twitter.;Elon Musk’s lawyers had asked for a delay to review the accusations by a former Twitter executive, which the judge denied, while allowing the information to form part of their case.
http://rss.nytimes.com/services/xml/rss/nyt/Technology.xml;https://www.nytimes.com/2022/09/07/magazine/screening-murdochs.html;2022-09-07 13:02:04+00:00;False;Join Us for a Screening of ‘The Murdochs’;Times subscribers can get a sneak peek of the documentary series on the legacy of the Murdochs, based on New York Times reporting.
http://rss.nytimes.com/services/xml/rss/nyt/Technology.xml;https://www.nytimes.com/2022/09/07/business/robots-automation-supply-chain.html;2022-09-07 09:00:38+00:00;False;The Supply Chain Broke. Robots Are Supposed to Help Fix It.;The companies behind e-commerce are embracing automation as the means of transcending the limitations of humans.
http://rss.nytimes.com/services/xml/rss/nyt/Technology.xml;https://www.nytimes.com/2022/09/07/technology/recruiters-tech-layoffs.html;2022-09-07 09:00:29+00:00;False;From Boom to Gloom: Tech Recruiters Struggle to Find Work;As tech companies slow hiring and lay off workers, once-busy recruiters are shifting to other roles and cutting their rates.