http://www.reddit.com/r/politics/.rss;https://www.reddit.com/r/politics/comments/x8dbm7/aoc_says_men_need_to_stand_up_for_abortion_rights/;2022-09-07 18:59:13+00:00;False;AOC Says Men Need to Stand up for Abortion Rights;<table> <tr><td> <a href="https://www.reddit.com/r/politics/comments/x8dbm7/aoc_says_men_need_to_stand_up_for_abortion_rights/"> <img alt="AOC Says Men Need to Stand up for Abortion Rights" src="https://external-preview.redd.it/24tPdD9TeHS_OVlGg67XOSLnwPHwylLh_vNnITHa6l8.jpg?width=640&amp;crop=smart&amp;auto=webp&amp;s=36523f841676abca84da64333f403e3f706c4314" title="AOC Says Men Need to Stand up for Abortion Rights" /> </a> </td><td> &#32; submitted by &#32; <a href="https://www.reddit.com/user
http://www.reddit.com/r/politics/.rss;https://www.reddit.com/r/politics/comments/x8bt32/gop_leaders_at_a_literal_loss_for_words_about/;2022-09-07 17:57:49+00:00;False;GOP leaders at a literal loss for words about Biden-era job growth | Biden-era job growth has been so exceptional that Republican leaders have to go out of their way to pretend not to notice the good news.;<table> <tr><td> <a href="https://www.reddit.com/r/politics/comments/x8bt32/gop_leaders_at_a_literal_loss_for_words_about/"> <img alt="GOP leaders at a literal loss for words about Biden-era job growth | Biden-era job growth has been so exceptional that Republican leaders have to go out of their way to pretend not to notice the good news." src="https://external-preview.redd.it/o7QcXxcZXNIb9D85XGfVFCU6u4d4zKOKgu5WCGhTlOY.jpg?width=640&amp;crop=smart&amp;auto=webp&amp;s=a84c44e0488a7e6908df04ec889
http://www.reddit.com/r/politics/.rss;https://www.reddit.com/r/politics/comments/x8aatm/twothirds_of_independents_say_they_dont_want/;2022-09-07 16:57:25+00:00;False;Two-thirds of independents say they don't want Trump to run for president;<table> <tr><td> <a href="https://www.reddit.com/r/politics/comments/x8aatm/twothirds_of_independents_say_they_dont_want/"> <img alt="Two-thirds of independents say they don't want Trump to run for president" src="https://external-preview.redd.it/Goi9l7sStywURw2XJRR1aMnJ7DUBqroQaE_Q-naKESo.jpg?width=640&amp;crop=smart&amp;auto=webp&amp;s=010a829293c31c6be6cc0d37402342bd242eeb23" title="Two-thirds of independents say they don't want Trump to run for president" /> </a> </td><td> &#32; submitted by
http://www.reddit.com/r/politics/.rss;https://www.reddit.com/r/politics/comments/x8a147/theres_a_lot_of_people_celebrating_prematurely/;2022-09-07 16:46:34+00:00;False;‘There’s a lot of people celebrating prematurely’: GOP could bring a legal challenge to block Biden’s student loan forgiveness plan;<table> <tr><td> <a href="https://www.reddit.com/r/politics/comments/x8a147/theres_a_lot_of_people_celebrating_prematurely/"> <img alt="‘There’s a lot of people celebrating prematurely’: GOP could bring a legal challenge to block Biden’s student loan forgiveness plan" src="https://external-preview.redd.it/LNzME-azr-rRUB8HGFDq3RIqvjufwUHyuM0Ith9nfGY.jpg?width=640&amp;crop=smart&amp;auto=webp&amp;s=e1356e18f9c11a8dc5d68db8faca630f67f6833c" title="‘There’s a lot of people celebrating prematurely’: 
http://www.reddit.com/r/politics/.rss;https://www.reddit.com/r/politics/comments/x89o5b/trump_should_not_run_for_president_in_2024/;2022-09-07 16:31:55+00:00;False;Trump should not run for president in 2024, majority of Americans say;<table> <tr><td> <a href="https://www.reddit.com/r/politics/comments/x89o5b/trump_should_not_run_for_president_in_2024/"> <img alt="Trump should not run for president in 2024, majority of Americans say" src="https://external-preview.redd.it/SZaA76uxnN_oSdgUDgEcugkpLcFfAwTCtRJNJkyUpuE.jpg?width=640&amp;crop=smart&amp;auto=webp&amp;s=8ed6109e9b39122e0ded1e177ec49d0b32ffbe69" title="Trump should not run for president in 2024, majority of Americans say" /> </a> </td><td> &#32; submitted by &#32; <a 
http://www.reddit.com/r/politics/.rss;https://www.reddit.com/r/politics/comments/x89npf/trump_reportedly_had_information_about_a_foreign/;2022-09-07 16:31:25+00:00;False;Trump Reportedly Had Information About a Foreign Government’s Nuclear Secrets at Mar-a-Lago, and Yeah, That’s Exactly as Bad as It Sounds;<table> <tr><td> <a href="https://www.reddit.com/r/politics/comments/x89npf/trump_reportedly_had_information_about_a_foreign/"> <img alt="Trump Reportedly Had Information About a Foreign Government’s Nuclear Secrets at Mar-a-Lago, and Yeah, That’s Exactly as Bad as It Sounds" src="https://external-preview.redd.it/uOY4mmLd4pIukVt4XWf_js8A3PCGYKl3nnxsxoLKdM0.jpg?width=640&amp;crop=smart&amp;auto=webp&amp;s=82e424b651bc068ae1ab9abe6f8d4fc828145612" title="Trump Reportedly Had Information About a Fo
http://www.reddit.com/r/politics/.rss;https://www.reddit.com/r/politics/comments/x890al/fox_news_host_speculates_trump_was_selling/;2022-09-07 16:06:04+00:00;False;Fox News Host Speculates Trump Was Selling Classified Documents to Russia;<table> <tr><td> <a href="https://www.reddit.com/r/politics/comments/x890al/fox_news_host_speculates_trump_was_selling/"> <img alt="Fox News Host Speculates Trump Was Selling Classified Documents to Russia" src="https://external-preview.redd.it/_jMdf0sP1UpyTFA1Gd1YdivJIIDmCkXyS-49RHwX5ts.jpg?width=320&amp;crop=smart&amp;auto=webp&amp;s=ad5d6c6b35e8fb59daae654befca6c9043fa7cb3" title="Fox News Host Speculates Trump Was Selling Classified Documents to Russia" /> </a> </td><td> &#32; submitted by &
http://www.reddit.com/r/politics/.rss;https://www.reddit.com/r/politics/comments/x88dhj/maga_republicans_are_a_variant_the_disease_is/;2022-09-07 15:40:57+00:00;False;‘MAGA Republicans’ are a variant. The disease is white supremacy;<table> <tr><td> <a href="https://www.reddit.com/r/politics/comments/x88dhj/maga_republicans_are_a_variant_the_disease_is/"> <img alt="‘MAGA Republicans’ are a variant. The disease is white supremacy" src="https://external-preview.redd.it/xBJphu6ec2aNJWwr5DDxRT1QorL-Yq-F3Bpl2o_1jo8.jpg?width=320&amp;crop=smart&amp;auto=webp&amp;s=1052120eb5668fc1993b71810e4b9d878fcc7848" title="‘MAGA Republicans’ are a variant. The disease is white supremacy" /> </a> </td><td> &#32; submitted by &#32; <a href="h
http://www.reddit.com/r/politics/.rss;https://www.reddit.com/r/politics/comments/x87ss9/miserable_little_weasel_omar_blasts_cruz_over_gop/;2022-09-07 15:18:12+00:00;False;'Miserable Little Weasel': Omar Blasts Cruz Over GOP Plan to Kill Student Debt Relief;<table> <tr><td> <a href="https://www.reddit.com/r/politics/comments/x87ss9/miserable_little_weasel_omar_blasts_cruz_over_gop/"> <img alt="'Miserable Little Weasel': Omar Blasts Cruz Over GOP Plan to Kill Student Debt Relief" src="https://external-preview.redd.it/WTzHs-isSAQY2MOJbRb5WB-hFEJYRWYJMvz1DWV7o0k.jpg?width=640&amp;crop=smart&amp;auto=webp&amp;s=98eb89b396da8bb2cb1170ba6d0206a85b547b09" title="'Miserable Little Weasel': Omar Blasts Cruz Over GOP Plan to Kill Student Debt Relief" /> </a>
http://www.reddit.com/r/politics/.rss;https://www.reddit.com/r/politics/comments/x875pi/names_of_hundreds_of_us_law_enforcement_officers/;2022-09-07 14:52:21+00:00;False;Names of hundreds of U.S. law enforcement officers, elected officials and military members appear on the leaked membership rolls of the Oathkeepers;&#32; submitted by &#32; <a href="https://www.reddit.com/user/totallywhatever"> /u/totallywhatever </a> <br /> <span><a href="https://www.adl.org/resources/report/oath-keepers-data-leak-unmasking-extremism-public-life">[link]</a></span> &#32; <span><a href="https://www.reddit.com/r/politics/comments/x875pi/names_of_hundreds_of_us_law_enforcement_officers/">[comments]</a></span>
http://www.reddit.com/r/politics/.rss;https://www.reddit.com/r/politics/comments/x86vub/more_democrats_than_republicans_say_theyll/;2022-09-07 14:40:51+00:00;False;More Democrats than Republicans say they’ll ‘definitely’ vote in midterms: survey;<table> <tr><td> <a href="https://www.reddit.com/r/politics/comments/x86vub/more_democrats_than_republicans_say_theyll/"> <img alt="More Democrats than Republicans say they’ll ‘definitely’ vote in midterms: survey" src="https://external-preview.redd.it/3IlBXEKJCPYJxLbySk7D2gAElv5HQdE_kc_rZX5u1b8.jpg?width=640&amp;crop=smart&amp;auto=webp&amp;s=f5c693b9cbfd8163d152a7261b6b482d6516f19d" title="More Democrats than Republicans say they’ll ‘definitely’ vote in midterms: survey" /> </a> </td><td> &#32
http://www.reddit.com/r/politics/.rss;https://www.reddit.com/r/politics/comments/x866bo/aoc_reveals_pessimism_about_running_for_president/;2022-09-07 14:12:29+00:00;False;AOC reveals pessimism about running for president: ‘I live in a country that would never let that happen’;<table> <tr><td> <a href="https://www.reddit.com/r/politics/comments/x866bo/aoc_reveals_pessimism_about_running_for_president/"> <img alt="AOC reveals pessimism about running for president: ‘I live in a country that would never let that happen’" src="https://external-preview.redd.it/n7sDi4Cc_oqwkOMEeJDU9z-cV2ofwBb8TsMdqwBiQwI.jpg?width=640&amp;crop=smart&amp;auto=webp&amp;s=98c9e6b1d2ee3f9d1513ff2b4e173ed9a5bcaeb4" title="AOC reveals pessimism about running for president: ‘I live in a country th
http://www.reddit.com/r/politics/.rss;https://www.reddit.com/r/politics/comments/x85ks1/trump_falsely_accuses_fbi_of_improperly_seizing/;2022-09-07 13:46:57+00:00;False;Trump falsely accuses FBI of ‘improperly’ seizing medical records showing his ‘absolutely perfect’ health;<table> <tr><td> <a href="https://www.reddit.com/r/politics/comments/x85ks1/trump_falsely_accuses_fbi_of_improperly_seizing/"> <img alt="Trump falsely accuses FBI of ‘improperly’ seizing medical records showing his ‘absolutely perfect’ health" src="https://external-preview.redd.it/xkp23s1KmoIB0Vc72-lLaIH_klVhDAhF7iHHsS8qJE0.jpg?width=640&amp;crop=smart&amp;auto=webp&amp;s=b24f8b7268c486be1219784ff498c0de5d9b8acf" title="Trump falsely accuses FBI of ‘improperly’ seizing medical records showing hi
http://www.reddit.com/r/politics/.rss;https://www.reddit.com/r/politics/comments/x85ji7/jan_6_defendant_turned_in_by_exgirlfriend_gets/;2022-09-07 13:45:22+00:00;False;Jan. 6 defendant turned in by ex-girlfriend gets nine months in prison;<table> <tr><td> <a href="https://www.reddit.com/r/politics/comments/x85ji7/jan_6_defendant_turned_in_by_exgirlfriend_gets/"> <img alt="Jan. 6 defendant turned in by ex-girlfriend gets nine months in prison" src="https://external-preview.redd.it/itUTKRCbrGz5zTo8oOC7ip_4_Izv_k2JTMRsdYEgM3k.jpg?width=640&amp;crop=smart&amp;auto=webp&amp;s=a223744718830d033a1ebaf23e67ff0d3bda1966" title="Jan. 6 defendant turned in by ex-girlfriend gets nine months in prison" /> </a> </td><td> &#32; submitted by &#3
http://www.reddit.com/r/politics/.rss;https://www.reddit.com/r/politics/comments/x85eax/new_from_adl_leaked_oath_keepers_membership_list/;2022-09-07 13:39:06+00:00;False;New from ADL: Leaked Oath Keepers’ Membership List Reveals Hundreds of Current & Former Law Enforcement Officers, Members of Military, and Elected Officials;&#32; submitted by &#32; <a href="https://www.reddit.com/user/ivanissac"> /u/ivanissac </a> <br /> <span><a href="https://www.adl.org/resources/press-release/new-adl-leaked-oath-keepers-membership-list-reveals-hundreds-current-former">[link]</a></span> &#32; <span><a href="https://www.reddit.com/r/politics/comments/x85eax/new_from_adl_leaked_oath_keepers_membership_list/">[comments]</a></span>
http://www.reddit.com/r/politics/.rss;https://www.reddit.com/r/politics/comments/x85dvx/trumps_spokesman_accused_the_washington_post_of/;2022-09-07 13:38:37+00:00;False;Trump's spokesman accused the Washington Post of 'colluding' with the FBI over a report nuclear secrets were kept at Mar-a-Lago;<table> <tr><td> <a href="https://www.reddit.com/r/politics/comments/x85dvx/trumps_spokesman_accused_the_washington_post_of/"> <img alt="Trump's spokesman accused the Washington Post of 'colluding' with the FBI over a report nuclear secrets were kept at Mar-a-Lago" src="https://external-preview.redd.it/0484eZf7f-dFHQLSKAGouOZZj46cyT7TUxGJENXU1x8.jpg?width=640&amp;crop=smart&amp;auto=webp&amp;s=675ceda04a28ab28449442e013c40d02dc68fa2c" title="Trump's spokesman accused the Washington Post of 'coll
http://www.reddit.com/r/politics/.rss;https://www.reddit.com/r/politics/comments/x84zb9/report_finds_alleged_link_between_oath_keepers/;2022-09-07 13:20:14+00:00;False;Report finds alleged link between Oath Keepers, public officials;<table> <tr><td> <a href="https://www.reddit.com/r/politics/comments/x84zb9/report_finds_alleged_link_between_oath_keepers/"> <img alt="Report finds alleged link between Oath Keepers, public officials" src="https://external-preview.redd.it/8lrgSknSTuD_c8TjqiibwQOkSTmh8Q95TtWVJe7JmjI.jpg?width=640&amp;crop=smart&amp;auto=webp&amp;s=e96bfb3819f4dd546013e2f9dbe1df2a6fa29bb1" title="Report finds alleged link between Oath Keepers, public officials" /> </a> </td><td> &#32; submitted by &#32; <a href="
http://www.reddit.com/r/politics/.rss;https://www.reddit.com/r/politics/comments/x84wjz/dr_oz_bought_palm_beach_megamansion_with_help_of/;2022-09-07 13:16:48+00:00;False;Dr. Oz bought Palm Beach mega-mansion with help of man embroiled in immigration fraud scheme;<table> <tr><td> <a href="https://www.reddit.com/r/politics/comments/x84wjz/dr_oz_bought_palm_beach_megamansion_with_help_of/"> <img alt="Dr. Oz bought Palm Beach mega-mansion with help of man embroiled in immigration fraud scheme" src="https://external-preview.redd.it/lmoHKkaTXGvEXsvvQVBcyyZoFua7oG_wY7K0p84o0VM.jpg?width=640&amp;crop=smart&amp;auto=webp&amp;s=a6f4c12f65303ebfcfa9a438b75e4f35a42ec7b0" title="Dr. Oz bought Palm Beach mega-mansion with help of man embroiled in immigration fraud sc
http://www.reddit.com/r/politics/.rss;https://www.reddit.com/r/politics/comments/x84him/can_we_stop_pretending_that_america_is_a/;2022-09-07 12:58:18+00:00;False;Can we stop pretending that America is a functioning democracy?;<table> <tr><td> <a href="https://www.reddit.com/r/politics/comments/x84him/can_we_stop_pretending_that_america_is_a/"> <img alt="Can we stop pretending that America is a functioning democracy?" src="https://external-preview.redd.it/-oPXK1yQjMLvFKCokRow7jdVxcTb_SDJ2Y319C1lJ7g.jpg?width=640&amp;crop=smart&amp;auto=webp&amp;s=0506c2e0b5704dcdb5c9aefb0c2e0a58cb975937" title="Can we stop pretending that America is a functioning democracy?" /> </a> </td><td> &#32; submitted by &#32; <a href="https://
http://www.reddit.com/r/politics/.rss;https://www.reddit.com/r/politics/comments/x83t5z/massachusetts_set_to_elect_first_female_gay/;2022-09-07 12:26:22+00:00;False;Massachusetts set to elect first female, gay governor over Trumpist opponent | Maura Healey cruises to Democratic primary victory and will face Republican Geoff Diehl, a supporter of Trump’s election lie;<table> <tr><td> <a href="https://www.reddit.com/r/politics/comments/x83t5z/massachusetts_set_to_elect_first_female_gay/"> <img alt="Massachusetts set to elect first female, gay governor over Trumpist opponent | Maura Healey cruises to Democratic primary victory and will face Republican Geoff Diehl, a supporter of Trump’s election lie" src="https://external-preview.redd.it/EjtqouM9J_WgCuoZF8rS2hSV3TM9jQhlCGLA1-WrT8Q.jpg?width=640&amp;crop=smart&amp;auto=webp&amp;s=6144705c640e2b9e8774437e63518e1
http://www.reddit.com/r/politics/.rss;https://www.reddit.com/r/politics/comments/x83hsu/trump_gop_candidate_will_rule_your_state_with_an/;2022-09-07 12:10:34+00:00;False;Trump: GOP candidate will “rule your state with an iron fist”;<table> <tr><td> <a href="https://www.reddit.com/r/politics/comments/x83hsu/trump_gop_candidate_will_rule_your_state_with_an/"> <img alt="Trump: GOP candidate will “rule your state with an iron fist”" src="https://external-preview.redd.it/IyxUu7eP3ABT9jXjlDsSh2ElQF65Z0En5nkVkI0wYUA.jpg?width=640&amp;crop=smart&amp;auto=webp&amp;s=31e78a56e4c774e21ea4f8c1ada56cb356516136" title="Trump: GOP candidate will “rule your state with an iron fist”" /> </a> </td><td> &#32; submitted by &#32; <a href="http
http://www.reddit.com/r/politics/.rss;https://www.reddit.com/r/politics/comments/x83cb8/barack_and_michelle_obama_return_to_the_white/;2022-09-07 12:02:42+00:00;False;Barack and Michelle Obama return to the White House for unveiling of official portraits;<table> <tr><td> <a href="https://www.reddit.com/r/politics/comments/x83cb8/barack_and_michelle_obama_return_to_the_white/"> <img alt="Barack and Michelle Obama return to the White House for unveiling of official portraits" src="https://external-preview.redd.it/KOkVr2L62WbnlQNd5fsXbhWa-xzBfUkr55JAJpe9YaU.jpg?width=640&amp;crop=smart&amp;auto=webp&amp;s=c1edbe79fb63a0601230d2ff8929b3ecfbcf3231" title="Barack and Michelle Obama return to the White House for unveiling of official portraits" /> </a>
http://www.reddit.com/r/politics/.rss;https://www.reddit.com/r/politics/comments/x832t5/crimes_of_the_powerful_why_the_maralago_special/;2022-09-07 11:49:33+00:00;False;Crimes of the powerful: Why the Mar-a-Lago "special master" decision is so dreadful;<table> <tr><td> <a href="https://www.reddit.com/r/politics/comments/x832t5/crimes_of_the_powerful_why_the_maralago_special/"> <img alt="Crimes of the powerful: Why the Mar-a-Lago &quot;special master&quot; decision is so dreadful" src="https://b.thumbs.redditmedia.com/JZM4oZygd9N_DUXnELpZVCzzK7vSLshUG1FX-JroATY.jpg" title="Crimes of the powerful: Why the Mar-a-Lago &quot;special master&quot; decision is so dreadful" /> </a> </td><td> &#32; submitted by &#32; <a href="https://www.reddit.com/user
http://www.reddit.com/r/politics/.rss;https://www.reddit.com/r/politics/comments/x82lfd/ron_desantis_faces_florida_lawsuit_over_antiwoke/;2022-09-07 11:24:47+00:00;False;Ron DeSantis faces Florida lawsuit over anti-woke law;<table> <tr><td> <a href="https://www.reddit.com/r/politics/comments/x82lfd/ron_desantis_faces_florida_lawsuit_over_antiwoke/"> <img alt="Ron DeSantis faces Florida lawsuit over anti-woke law" src="https://external-preview.redd.it/TMb7znteY_Wky9L4eh--njcrxmX8307IBaUf3KXFGiA.jpg?width=640&amp;crop=smart&amp;auto=webp&amp;s=083379b3a32fc88f165dc957de8b5ea48f593e65" title="Ron DeSantis faces Florida lawsuit over anti-woke law" /> </a> </td><td> &#32; submitted by &#32; <a href="https://www.reddit.c
http://www.reddit.com/r/politics/.rss;https://www.reddit.com/r/politics/comments/x82727/deeply_alarming_files_seized_from_trump_include/;2022-09-07 11:04:00+00:00;False;'Deeply Alarming': Files Seized From Trump Include Document on Foreign Nation's Nuclear Capacity;<table> <tr><td> <a href="https://www.reddit.com/r/politics/comments/x82727/deeply_alarming_files_seized_from_trump_include/"> <img alt="'Deeply Alarming': Files Seized From Trump Include Document on Foreign Nation's Nuclear Capacity" src="https://external-preview.redd.it/NG8JNsn0pQYojZwhkV2VL0CO0ny0Spra3Ft_RVXnnQc.jpg?width=640&amp;crop=smart&amp;auto=webp&amp;s=c00251670fc12fa686fb5dc0028cb34375f747e5" title="'Deeply Alarming': Files Seized From Trump Include Document on Foreign Nation's Nucle
http://www.reddit.com/r/politics/.rss;https://www.reddit.com/r/politics/comments/x81yfn/dr_oz_told_radio_show_incest_not_a_big_problem_as/;2022-09-07 10:51:15+00:00;False;Dr Oz told radio show incest ‘not a big problem’ as long as ‘more than a first cousin away’ | Yet another issue where Oz and I disagree,’ tweets opponent John Fetterman;<table> <tr><td> <a href="https://www.reddit.com/r/politics/comments/x81yfn/dr_oz_told_radio_show_incest_not_a_big_problem_as/"> <img alt="Dr Oz told radio show incest ‘not a big problem’ as long as ‘more than a first cousin away’ | Yet another issue where Oz and I disagree,’ tweets opponent John Fetterman" src="https://external-preview.redd.it/yF8XR0UvYS2JbW6QsXMIh15Lbxnux4jqcM2hiveHK_0.jpg?width=640&amp;crop=smart&amp;auto=webp&amp;s=07ce1627ee675741fbc3ac943fee0f32f1056363" title="Dr Oz told 
http://www.reddit.com/r/politics/.rss;https://www.reddit.com/r/politics/comments/x81i97/the_trump_special_master_ruling_violates_the/;2022-09-07 10:24:54+00:00;False;The Trump ‘special master’ ruling violates the principle that no-one is above the law;<table> <tr><td> <a href="https://www.reddit.com/r/politics/comments/x81i97/the_trump_special_master_ruling_violates_the/"> <img alt="The Trump ‘special master’ ruling violates the principle that no-one is above the law" src="https://external-preview.redd.it/OdN5PHfubA6TU7vd3haYU4G90eKT7jp-iYsoEmdIIw4.jpg?width=640&amp;crop=smart&amp;auto=webp&amp;s=dd16335fa01ee329caa164db46fbcbb0c3a03752" title="The Trump ‘special master’ ruling violates the principle that no-one is above the law" /> </a> </td
http://www.reddit.com/r/politics/.rss;https://www.reddit.com/r/politics/comments/x81ez6/trumps_special_master_situation_is_shady_as_fuck/;2022-09-07 10:19:38+00:00;False;Trump’s Special Master Situation Is Shady as Fuck, Say Legal Experts;<table> <tr><td> <a href="https://www.reddit.com/r/politics/comments/x81ez6/trumps_special_master_situation_is_shady_as_fuck/"> <img alt="Trump’s Special Master Situation Is Shady as Fuck, Say Legal Experts" src="https://external-preview.redd.it/Jiuqb9HpwhubID4naPBq06uduq_yX_Ac8FRw_zPyMGY.jpg?width=640&amp;crop=smart&amp;auto=webp&amp;s=f44765e06e591db66160f6431c3bd6f538ce3596" title="Trump’s Special Master Situation Is Shady as Fuck, Say Legal Experts" /> </a> </td><td> &#32; submitted by &#32;
http://www.reddit.com/r/politics/.rss;https://www.reddit.com/r/politics/comments/x7zie5/elected_officials_police_chiefs_on_leaked_oath/;2022-09-07 08:19:45+00:00;False;Elected officials, police chiefs on leaked Oath Keepers list;<table> <tr><td> <a href="https://www.reddit.com/r/politics/comments/x7zie5/elected_officials_police_chiefs_on_leaked_oath/"> <img alt="Elected officials, police chiefs on leaked Oath Keepers list" src="https://external-preview.redd.it/gtfG6FI18KF_OsuqW_jWsb71FCwgz3kPE9mTpQLzSaE.jpg?width=640&amp;crop=smart&amp;auto=webp&amp;s=9b1f70e69c980ecdb93dc0545be9227073edcdf5" title="Elected officials, police chiefs on leaked Oath Keepers list" /> </a> </td><td> &#32; submitted by &#32; <a href="https://
http://www.reddit.com/r/politics/.rss;https://www.reddit.com/r/politics/comments/x7v3h8/unsealed_fbi_docs_reveal_a_flurry_of_calls_and/;2022-09-07 04:02:52+00:00;False;Unsealed FBI docs reveal a flurry of calls and stock trades by Sen. Burr in early 2020;<table> <tr><td> <a href="https://www.reddit.com/r/politics/comments/x7v3h8/unsealed_fbi_docs_reveal_a_flurry_of_calls_and/"> <img alt="Unsealed FBI docs reveal a flurry of calls and stock trades by Sen. Burr in early 2020" src="https://external-preview.redd.it/MRHSfYi8_wH6EXTbNkZY8HDKwER-l-CHMUMO38tIYRk.jpg?width=640&amp;crop=smart&amp;auto=webp&amp;s=4099836bf4565d85ab2bb5550e384954c440f00b" title="Unsealed FBI docs reveal a flurry of calls and stock trades by Sen. Burr in early 2020" /> </a> 
http://www.reddit.com/r/politics/.rss;https://www.reddit.com/r/politics/comments/x7uynu/report_trump_stored_another_countrys_nuclear/;2022-09-07 03:56:41+00:00;False;Report: Trump Stored Another Country’s Nuclear Secrets at Fucking Mar-a-Lago;<table> <tr><td> <a href="https://www.reddit.com/r/politics/comments/x7uynu/report_trump_stored_another_countrys_nuclear/"> <img alt="Report: Trump Stored Another Country’s Nuclear Secrets at Fucking Mar-a-Lago" src="https://external-preview.redd.it/hECP77Xg1sBy3I5oFR5Fzosfg4oRQuV7mjf5NI-EVZ8.jpg?width=640&amp;crop=smart&amp;auto=webp&amp;s=69bac47c0cceb3c1c93a8048fdcf494943a79ba5" title="Report: Trump Stored Another Country’s Nuclear Secrets at Fucking Mar-a-Lago" /> </a> </td><td> &#32; submit
http://www.reddit.com/r/politics/.rss;https://www.reddit.com/r/politics/comments/x7u22p/steve_bannon_expected_to_surrender_thursday_on/;2022-09-07 03:11:40+00:00;False;Steve Bannon expected to surrender Thursday on New York state charges related to border wall effort | CNN Politics;<table> <tr><td> <a href="https://www.reddit.com/r/politics/comments/x7u22p/steve_bannon_expected_to_surrender_thursday_on/"> <img alt="Steve Bannon expected to surrender Thursday on New York state charges related to border wall effort | CNN Politics" src="https://external-preview.redd.it/ZDJiVbpnPIY_9ljeT7lSuoEyxYUf4pw6cMolRln1VhI.jpg?width=640&amp;crop=smart&amp;auto=webp&amp;s=dfcfa72ede74ec7f8836e076490f6e5206c23f23" title="Steve Bannon expected to surrender Thursday on New York state charge
http://www.reddit.com/r/politics/.rss;https://www.reddit.com/r/politics/comments/x7t8zw/steve_bannon_faces_state_indictment_in_ny_will/;2022-09-07 02:32:58+00:00;False;Steve Bannon faces state indictment in N.Y., will surrender Thursday;<table> <tr><td> <a href="https://www.reddit.com/r/politics/comments/x7t8zw/steve_bannon_faces_state_indictment_in_ny_will/"> <img alt="Steve Bannon faces state indictment in N.Y., will surrender Thursday" src="https://external-preview.redd.it/vpDTudfBIdr-rBRPCJgQAe2UKadQ8Ob-oaFlsc-Xffs.jpg?width=640&amp;crop=smart&amp;auto=webp&amp;s=d3460cab90edb3e6510e907f7381491241903b19" title="Steve Bannon faces state indictment in N.Y., will surrender Thursday" /> </a> </td><td> &#32; submitted by &#32; <
