https://www.pcworld.com/index.rss;https://www.pcworld.com/article/818199/back-to-school-deals.html;2022-09-06 19:47:32+00:00;False;Best Back to School deals: laptops, Chromebooks, tablets and more;<div id="link_wrapped_content">
<section class="wp-block-bigbite-multi-title"><div class="container"></div></section><p>What we call back to school deals are moving from &ldquo;back-to-school&rdquo; to &ldquo;at-school,&rdquo; with sales on laptops, Chomebooks, displays and more. Amazon&rsquo;s MacBook back-to-school sale is about as good as you&rsquo;ll find. We&rsquo;re still seeing early back-to-school deals remain at their earlier prices, though.</p>



<p>We&rsquo;ve carefully examined the 
https://www.pcworld.com/index.rss;https://www.pcworld.com/article/436674/the-best-pc-laptops-of-the-year.html;2022-09-06 19:04:19+00:00;False;The best laptops: Premium laptops, budget laptops, 2-in-1s, and more;<div id="link_wrapped_content">
<section class="wp-block-bigbite-multi-title"><div class="container"></div></section><p>Looking to upgrade to a brand-new laptop? If so, you&rsquo;ve come to the right place. We&rsquo;ve scoured the market looking for the top laptops and curated an even more select list of the very best available right now. All of the picks below have been personally tested and vetted by our experts here at PCWorld. From classic clamshells to versatile 2-in-1&rsquo;s, we&rsquo;ve 
https://www.pcworld.com/index.rss;https://www.pcworld.com/article/407214/best-pdf-editors.html;2022-09-06 16:00:00+00:00;False;Best PDF editors: Our top picks;<div id="link_wrapped_content">
<section class="wp-block-bigbite-multi-title"><div class="container"></div></section><p>Though it&rsquo;s nearly 25 years old, the PDF may be more useful than ever in our increasingly multi-device, cross-platform world. Most of the time you can get by with a free PDF reader to review and comment on these files. But inevitably, particularly in a business setting, you&rsquo;ll need to edit a PDF file and that usually requires upgrading to a premium PDF editor.</p>


https://www.pcworld.com/index.rss;https://www.pcworld.com/article/953370/quality-of-life-update-makes-bioshock-games-unplayable-on-steam-deck-and-linux.html;2022-09-06 14:39:12+00:00;False;‘Quality of Life’ update makes Bioshock games unplayable on Steam Deck, Linux;<div id="link_wrapped_content">
<section class="wp-block-bigbite-multi-title"><div class="container"></div></section><p>Software updates are generally supposed to make software, you know, better. That&rsquo;s especially true when you label an update &ldquo;quality of life,&rdquo; as is the case with the latest patches for 2K&rsquo;s classic <em>Bioshock </em>FPS series. But the newest patches to <em><a href="https://go.redirectingat.com/?id=111346X1569483&amp;url=https://store.steampowered.com/a
https://www.pcworld.com/index.rss;https://www.pcworld.com/article/833338/windows-file-history-review.html;2022-09-06 14:30:00+00:00;False;Windows File History review: Free, effective continuous data protection;<div id="link_wrapped_content">
<section class="wp-block-bigbite-multi-title"><div class="container"></div></section><div class="review" id="review-body"><img alt="Editors' Choice" class="review-logo" src="https://www.pcworld.com/wp-content/uploads/2021/09/PC-ED-CHOICE.png" /><span class="review-title">At a glance</span><h3 class="review-subTitle" id="experts-rating">Expert's Rating</h3><div class="starRating"></div>
<div><div class="review-columns"><div class="review-column"><h3 class="review-s
https://www.pcworld.com/index.rss;https://www.pcworld.com/article/920637/the-new-edge-sidebar-adds-widgets-that-actually-make-sense.html;2022-09-06 14:22:31+00:00;False;Microsoft Edge’s new sidebar widgets are actually worth using;<div id="link_wrapped_content">
<section class="wp-block-bigbite-multi-title"><div class="container"></div></section><p>If <a href="https://www.pcworld.com/article/394959/why-switch-google-chrome-microsoft-edge.html">you use Microsoft Edge</a>, you may notice something new to the right of your browser as of late last week: a small vertical sidebar of icons. Some, specifically a collection of widgets called Tools, are actually worth using.</p>



<p>Adding sidebars functionality isn&rsquo;t new; 
https://www.pcworld.com/index.rss;https://www.pcworld.com/article/921158/microsoft-first-windows-11-moment-october.html;2022-09-06 13:39:39+00:00;False;Windows 11’s first ‘Moment’ upgrade may come in October;<div id="link_wrapped_content">
<section class="wp-block-bigbite-multi-title"><div class="container"></div></section><p>Two new releases of Windows 11 may end up right on top of one another, according to tweets from a noted Microsoft leaker.</p>



<p>Microsoft is currently scheduling <a href="https://www.pcworld.com/article/827065/windows-11-22h2-review-subtle-improvements-but-not-where-it-should.html">Windows 11 22H2</a>, the next major feature release, for this month or next &mdash; September
https://www.pcworld.com/index.rss;https://www.pcworld.com/article/934851/934851.html;2022-09-06 12:56:41+00:00;False;Nab this chic Lenovo IdeaPad gaming laptop for $750;<div id="link_wrapped_content">
<section class="wp-block-bigbite-multi-title"><div class="container"></div></section><p>If you&rsquo;re in the market for an entry-level gaming laptop, you&rsquo;re in luck, as we&rsquo;ve got a fantastic deal for you today. <a href="https://go.redirectingat.com/?id=111346X1569483&amp;url=https://www.microcenter.com/product/648255/lenovo-ideapad-gaming-156-laptop-computer-platinum-collection-grey&amp;xcust=2-2-934851-1-0-0&amp;sref=https://www.pcworld.com/feed" re
https://www.pcworld.com/index.rss;https://www.pcworld.com/article/919457/amd-fsr-1-0-vs-fsr-2-0.html;2022-09-06 10:45:00+00:00;False;AMD FSR 1.0 vs. FSR 2.0: Which upscaling tech should you use?;<div id="link_wrapped_content">
<section class="wp-block-bigbite-multi-title"><div class="container"></div></section><p>We want our cake, and you bet we&rsquo;re eating it too! What gamer doesn&rsquo;t want beautiful graphics <em>and</em> high frame rates? AMD&rsquo;s FSR, or FidelityFX Super Resolution, does just that by using upscaling technology.&nbsp;</p>



		<div class="wp-block-product-widget-block product-widget is-half-width is-float-right">
			<div class="product-widget__block-title-wr
https://www.pcworld.com/index.rss;https://www.pcworld.com/article/407990/the-best-budget-computer-speakers.html;2022-09-06 10:30:00+00:00;False;The best budget computer speakers: Surprisingly sound choices for $100 or less;<div id="link_wrapped_content">
<section class="wp-block-bigbite-multi-title"><div class="container"></div></section><p>Don&rsquo;t let your favorite music and movies go to waste as you play them through your laptop&rsquo;s built-in sound system. Your audio can come out sounding weak and lifeless with even the best laptop speakers. External PC speakers&mdash;along with a <a href="https://www.pcworld.com/article/544134/the-best-wireless-earbuds-free-yourself-from-the-tyranny-of-cords.html">good s
https://www.pcworld.com/index.rss;https://www.pcworld.com/article/919979/pick-up-this-refurbished-microsoft-surface-at-a-great-price.html;2022-09-06 08:00:00+00:00;False;Pick up this refurbished Microsoft Surface at a great price;<div id="link_wrapped_content">
<section class="wp-block-bigbite-multi-title"><div class="container"></div></section><p>Whether you&rsquo;re searching for an upgrade in&nbsp;<a href="https://www.pcworld.com/article/538941/microsoft-surface-pro-8-review.html" rel="noreferrer noopener" target="_blank">personal technology</a>&nbsp;for educational, entertainment, or professional needs, there are a variety of potential paths to explore. For those attempting to balance their bank budget without sacrif