https://www.chip.pl/feed/;https://www.chip.pl/2022/09/ludzki-mikrobiom-w-laboratorium-eksperyment/;2022-09-06 20:00:00+00:00;False;Stworzyli ludzki mikrobiom w laboratorium. Jak udało się tego dokonać?;<p><img src="https://www.chip.pl/wp-content/uploads/2022/09/mikrobiom.jpg" style="display: block; margin: 1em auto;" /></p>
<p>Naukowcy z Uniwersytetu Stanforda stworzyli w laboratorium pierwszy ludzki mikrobiom. Wykorzystali w tym celu 119 gatunk&#243;w bakterii znalezionych w naszych organizmach. Mikrobiom jelitowy sk&#322;ada si&#281; z setek gatunk&#243;w bakterii, kt&#243;re bytuj&#261; w naszym uk&#322;adzie pokarmowym. Do ich zada&#324; nale&#380;y mi&#281;dzy innymi wspieranie funkcjonow
https://www.chip.pl/feed/;https://www.chip.pl/2022/09/karaczany-cyborgi-riken/;2022-09-06 17:00:00+00:00;False;Karaczany-cyborgi mogą sprawdzić się tam, gdzie ludzie nie dają rady;<p><img src="https://www.chip.pl/wp-content/uploads/2022/09/insect-g2ce692ba8_1920.jpg" style="display: block; margin: 1em auto;" /></p>
<p>Naukowcy tworz&#261; karaczany-cyborgi wyposa&#380;one w niewielkie plecaki i zasilane energi&#261; s&#322;oneczn&#261;. Brzmi to niewiarygodnie, ale tak zmodyfikowane owady mog&#261; znale&#378;&#263; zastosowanie w przysz&#322;ych misjach ratunkowych lub do eksploracji niebezpiecznych miejsc. Nad materializacj&#261; tego pomys&#322;u pracowano od lat. Zesp
https://www.chip.pl/feed/;https://www.chip.pl/2022/09/seria-huawei-mate-50-premiera-specyfikacja/;2022-09-06 16:31:44+00:00;False;Doczekaliśmy się. Seria Huawei Mate 50 zadebiutowała oficjalnie;<p><img src="https://www.chip.pl/wp-content/uploads/2022/09/huawei-mate-50-pro-premiera-4.jpg" style="display: block; margin: 1em auto;" /></p>
<p>Z powodu sankcji na&#322;o&#380;onych przez USA Huawei musia&#322; zmieni&#263; sw&#243;j harmonogram premier i na kolejne modele Mate musieli&#347;my czeka&#263; a&#380; rok. Dzi&#347; bowiem og&#322;oszono seri&#281; Huawei Mate 50, kt&#243;ra sk&#322;ada si&#281; z a&#380; czterech smartfon&#243;w. Huawei Mate 50, Mate 50 Pro, Mate 50 RS i Mate 50E
https://www.chip.pl/feed/;https://www.chip.pl/2022/09/huawei-nova-10z-premiera/;2022-09-06 16:00:23+00:00;False;Huawei wprowadza na rynek nowy model z serii nova 10. Niestety, już nie tak ładny;<p><img src="https://www.chip.pl/wp-content/uploads/2022/09/huawei-nova-10z-premiera.jpg" style="display: block; margin: 1em auto;" /></p>
<p>Kilka dni po globalnej premierze serii nova 10, Huawei wprowadza na Chi&#324;ski rynek kolejny model z tej rodziny. Przyjrzyjmy si&#281; wi&#281;c bli&#380;ej, co ma do zaoferowania nova 10z. Je&#347;li widzieli&#347;cie seri&#281; Huawei nova 10, z pewno&#347;ci&#261; zwr&#243;cili&#347;cie uwag&#281; na ich przepi&#281;kny design. Niestety, model nova 10
https://www.chip.pl/feed/;https://www.chip.pl/2022/09/tsmc-produkcja-ukladow-qualcomm-i-mediatek/;2022-09-06 15:30:00+00:00;False;Nie tylko Snapdragon, ale też Dimensity – TSMC zgarnia produkcję tegorocznych flagowych układów;<p><img src="https://www.chip.pl/wp-content/uploads/2022/06/tsmc-1.jpg" style="display: block; margin: 1em auto;" /></p>
<p>Po problemach z przegrzewaniem (i nie tylko) SoC Snapdragon Gen 1 produkowanych przez Samsunga, Qualcomm og&#322;osi&#322; przej&#347;cie do TSMC. Tajwa&#324;ska firma nie tylko dostarczy&#322;a Snapdragona 8+ Gen 1, ale r&#243;wnie&#380; zajmie si&#281; produkcj&#261; innych uk&#322;ad&#243;w nowej generacji, na czele z nadchodz&#261;cym flagowcem. Co ciekawe, nie b&#281;d
https://www.chip.pl/feed/;https://www.chip.pl/2022/09/szczegoly-nowej-czesci-antybalistycznej-tarczy-polski/;2022-09-06 15:00:00+00:00;False;Szczegóły nowej części antybalistycznej tarczy Polski. Wspomoże nas koncern MBDA;<p><img src="https://www.chip.pl/wp-content/uploads/2022/06/Nocny-test-polskiego-systemu-przeciwlotniczego-zakonczony.-Piorun-i-Pilica-w-akcji-3.jpg" style="display: block; margin: 1em auto;" /></p>
<p>W&#322;a&#347;nie poznali&#347;my szczeg&#243;&#322;y nowej cz&#281;&#347;ci antybalistycznej tarczy Polski, w kt&#243;rej stworzeniu pomo&#380;e nam MBDA poprzez dostarczenie pocisk&#243;w CAMM. W praktyce bowiem okaza&#322;o si&#281; w&#322;a&#347;nie, &#380;e plany ulepszenia systemu Pilica do 
https://www.chip.pl/feed/;https://www.chip.pl/2022/09/test-sennheiser-momentum-4-wireless-zegnamy-elegancki-styl-w-miejscu-minimalizmu/;2022-09-06 14:30:00+00:00;False;Test Sennheiser Momentum 4 Wireless. Żegnamy elegancki styl w miejscu minimalizmu;<p><img src="https://www.chip.pl/wp-content/uploads/2022/09/sennheiser-momentum-4-02.jpg" style="display: block; margin: 1em auto;" /></p>
<p>Seria Momentum firmy Sennheiser od zawsze kojarzy&#322;a si&#281; nam ze s&#322;uchawkami o eleganckim, bardziej klasycznym wygl&#261;dzie, ale to najwyra&#378;niej nie zda&#322;o pr&#243;by czasu. Tak przynajmniej wynika ze zmian, na kt&#243;re zdecydowa&#322; si&#281; producent przy modelu Momentum 4 Wireless. Czy to dobrze, czy to &#378;le, wiadomo, to 
https://www.chip.pl/feed/;https://www.chip.pl/2022/09/pompa-ciepla-energia-ze-sciekow-dania/;2022-09-06 12:30:00+00:00;False;Energia z miejskich ścieków? W tym miejscu ruszy nietypowa pompa ciepła;<p><img src="https://www.chip.pl/wp-content/uploads/2022/09/heat-pump-6209793_1920.jpg" style="display: block; margin: 1em auto;" /></p>
<p>W du&#324;skim mie&#347;cie Frederikssund wkr&#243;tce ruszy nowa pompa ciep&#322;a w lokalnej oczyszczalni &#347;ciek&#243;w, kt&#243;ra b&#281;dzie podgrzewa&#263; wod&#281; dla mieszka&#324;c&#243;w. Technologia pomp ciep&#322;a zyskuje na popularno&#347;ci nie tylko w Polsce, ale r&#243;wnie&#380; za granicami naszego kraju. Dania kolejny raz pokaza&#322
https://www.chip.pl/feed/;https://www.chip.pl/2022/09/wszystko-co-wiemy-o-geforce-rtx-4000/;2022-09-06 11:30:03+00:00;False;Spójrzcie na flagową kartę nowej generacji. Oto wszystko, co wiemy o GeForce RTX 4000 [Aktualizacja];<p><img src="https://www.chip.pl/wp-content/uploads/2022/01/Nowy-GeForce-RTX-3060-Ti-na-horyzoncie-NVIDIA-moze-postawic-na-GA103.jpg" style="display: block; margin: 1em auto;" /></p>
<p>Oficjalnie rozpoczynamy nowy, na bie&#380;&#261;co aktualizowany, wpis na temat kart graficznych NVIDIA nowej generacji. W tym artykule przeka&#380;emy Wam wszystko, co wiemy o GeForce RTX 4000, regularnie aktualizuj&#261;c go za ka&#380;dym razem, kiedy &#347;wiat obiegnie wa&#380;na informacja na ich temat. Dla
https://www.chip.pl/feed/;https://www.chip.pl/2022/09/kask-motocyklowy-z-filtrem-hepa/;2022-09-06 10:30:00+00:00;False;Kask motocyklowy z filtrem HEPA gwarantuje całkowitą wolność od nieprzyjemnych zapachów;<p><img src="https://www.chip.pl/wp-content/uploads/2022/09/Kask-motocyklowy-z-filtrem-HEPA-gwarantuje-calkowita-wolnosc-od-nieprzyjemnych-zapachow-1.jpg" style="display: block; margin: 1em auto;" /></p>
<p>Je&#380;d&#380;&#261;c samochodem brakuje nam &#8220;dozna&#324;&#8221;, kt&#243;re prze&#380;ywaj&#261; motocykli&#347;ci i rowerzy&#347;ci, mog&#261;c wdycha&#263; zapachy otoczenia. O ile podr&#243;&#380; przez las mo&#380;e zapewni&#263; nam b&#322;ogi zapach iglak&#243;w, a nad morzem po
https://www.chip.pl/feed/;https://www.chip.pl/2022/09/xwave-firmy-calwave/;2022-09-06 10:00:00+00:00;False;Przez dziesięć miesięcy generował prąd z fal. Czym jest xWave firmy CalWave?;<p><img src="https://www.chip.pl/wp-content/uploads/2022/09/Przez-dziesiec-miesiecy-generowal-prad-z-fal.-Czym-jest-xWave-firmy-CalWave-2.jpg" style="display: block; margin: 1em auto;" /></p>
<p>Elektrownie w &#347;rodowisku morskim i oceanicznym zawsze maj&#261; &#8220;trudniej&#8221; od tych na l&#261;dzie. Nie bez powodu, a przez problematyczn&#261; kwesti&#281; przyspieszania procesu korozji i trudno&#347;ci w instalacji system&#243;w oraz ich utrzymania. Firma CalWave doskonale o tym wie, a
https://www.chip.pl/feed/;https://www.chip.pl/2022/09/honor-magicbook-14-kompaktowy-laptop/;2022-09-06 09:30:00+00:00;False;Oto HONOR MagicBook 14. Kompaktowy laptop o zaskakującej wytrzymałości na jednym ładowaniu;<p><img src="https://www.chip.pl/wp-content/uploads/2022/09/Oto-HONOR-MagicBook-14.-Kompaktowy-laptop-skoncentrowany-na-wytrzymalosci-baterii-3.jpg" style="display: block; margin: 1em auto;" /></p>
<p>Ju&#380; teraz mo&#380;ecie sk&#322;ada&#263; przedpremierowe zam&#243;wienia na kompaktowy laptop skoncentrowany na wytrzyma&#322;o&#347;ci baterii, jakim jest HONOR MagicBook 14. Ten jest dost&#281;pny w cenie 1099 euro i doczeka&#322; si&#281; premiery podczas targ&#243;w IFA 2022 w Berlinie. Pr
https://www.chip.pl/feed/;https://www.chip.pl/2022/09/saab-mshorad-mobilny-system-przeciwlotniczy/;2022-09-06 08:30:00+00:00;False;Mobilny system przeciwlotniczy krótkiego zasięgu wystrzelił. To MSHORAD firmy Saab;<p><img src="https://www.chip.pl/wp-content/uploads/2022/09/Mobilny-system-przeciwlotniczy-krotkiego-zasiegu-wystrzelil.-To-MSHORAD-firmy-Saab-2.jpg" style="display: block; margin: 1em auto;" /></p>
<p>Szwedzki koncern Saab Group w ramach wsp&#243;&#322;pracy z czesk&#261; firm&#261; SVOS postanowi&#322; oprze&#263; mobilny system obrony przeciwlotniczej bliskiego zasi&#281;gu MSHORAD (Mobile Very Short Range Air Defense) na samochodzie terenowym. Prezentacji tego po&#322;&#261;czenia doczekali&
https://www.chip.pl/feed/;https://www.chip.pl/2022/09/brazowy-karzel-jwst-vhs-1256-1257-b/;2022-09-06 07:00:00+00:00;False;Ten brązowy karzeł ma zaskakujący skład. Potwierdziła się długoletnia teoria;<p><img src="https://www.chip.pl/wp-content/uploads/2021/08/1280px-Artists_conception_of_a_brown_dwarf_like_2MASSJ22282889-431026.jpg" style="display: block; margin: 1em auto;" /></p>
<p>Obserwacje prowadzone z wykorzystaniem Kosmicznego Teleskopu Jamesa Webba wykaza&#322;y trafno&#347;&#263; teorii dotycz&#261;cej obiekt&#243;w gwiazdopodobnych takich jak VHS 1256-1257 b. Wspomniany teleskop bezpo&#347;rednio wykry&#322; bowiem chmury krzemianowe w atmosferze br&#261;zowego kar&#322;a, co stano
https://www.chip.pl/feed/;https://www.chip.pl/2022/09/nowy-telewizor-the-frame-matowy-ekran/;2022-09-06 06:30:00+00:00;False;Nowy telewizor The Frame dostaje rewolucyjny matowy ekran;<p><img src="https://www.chip.pl/wp-content/uploads/2022/01/samsung-the-frame-1.jpg" style="display: block; margin: 1em auto;" /></p>
<p>Telewizory The Frame zyska&#322;y ogromn&#261; popularno&#347;&#263; g&#322;&#243;wnie dzi&#281;ki temu, &#380;e nie do ko&#324;ca przypominaj&#261; klasyczne telewizory. Wymienne ramki, mo&#380;liwo&#347;&#263; wy&#347;wietlania na nich dzie&#322; sztuki, to wszystko sprawia, &#380;e urz&#261;dzenie mo&#380;emy wkomponowa&#263; w wystr&#243;j wn&#281;trza tak,
https://www.chip.pl/feed/;https://www.chip.pl/2022/09/nowy-okret-podwodny-brazylii-scorpene-riachuelo/;2022-09-06 04:00:00+00:00;False;Nowy okręt podwodny Brazylii już na służbie. Niegdyś jego typ mógł trafić w ręce Polaków;<p><img src="https://www.chip.pl/wp-content/uploads/2022/09/Nowy-okret-podwodny-Brazylii-juz-na-sluzbie.-To-one-mogly-trafic-niegdys-w-rece-Polakow.jpg" style="display: block; margin: 1em auto;" /></p>
<p>We wrze&#347;niu 2014 roku producent okr&#281;t&#243;w typu Scorpene, a wi&#281;c koncern DCNS, zapowiedzia&#322; zaproponowanie ich polskiej Marynarce Wojennej w planowanym przetargu na trzy nowe okr&#281;ty podwodne w ramach programu Orka. Jak to si&#281; zako&#324;czy&#322;o? Wiecie zapewne 
https://www.chip.pl/feed/;https://www.chip.pl/2022/09/solar-orbiter-koronalny-wyrzut-masy-slonce/;2022-09-06 04:00:00+00:00;False;Solar Orbiter trafiona. Sonda padła ofiarą naszej gwiazdy;<p><img src="https://www.chip.pl/wp-content/uploads/2022/09/sonda-slonce.jpg" style="display: block; margin: 1em auto;" /></p>
<p>Jak poinformowali przedstawiciele Europejskiej Agencji Kosmicznej, w minion&#261; niedziel&#281; sonda Solar Orbiter zosta&#322;a trafiona przez tzw. koronalny wyrzut masy. Start misji mia&#322; miejsce na pocz&#261;tku 2020 roku, a sonda wykorzystuje tzw. manewr asysty grawitacyjnej, aby utrzyma&#263; odpowiedni&#261; trajektori&#281; i zbli&#380;y&#263; si&#281; do 